{
  "activation_ceiling": "implicit_local_pilot",
  "bundle_id": "frontier-engineering/11.4.0",
  "compatible_schema_epoch": 9,
  "release_build_id": "build-7ac1d8a0a47a3f8b7c2d6504",
  "remote_writes": false,
  "schema_version": "frontier-engineering-bundle/2.0",
  "skills": {
    "code-review": {
      "allow_implicit_invocation": true,
      "root_hash": "sha256:f9860e43021b78bc6f33f4e28dc5b5809bd423a82ad4fcb78e3dbf3df2361dbd",
      "version": "2.0.5"
    },
    "code-simplifier": {
      "allow_implicit_invocation": true,
      "root_hash": "sha256:8e563e972b9974420660c8fa55a712460e552db47857d5d0a1fd07f592275942",
      "version": "1.2.1"
    },
    "codebase-improve": {
      "allow_implicit_invocation": false,
      "root_hash": "sha256:adf1cb28625b8cb4974b69946e953876c9c0711b5841a7daab01bbb82b04d855",
      "version": "1.0.0"
    },
    "codebase-investigation": {
      "allow_implicit_invocation": true,
      "root_hash": "sha256:349266a97ed82e384dc71de7aa7d31da95e7da00f96a66aae10aaf7840036c63",
      "version": "1.1.2"
    },
    "debugging": {
      "allow_implicit_invocation": true,
      "root_hash": "sha256:d3743653093db384e4cacdeda2ac256cd85f47d2125499fe29985cdc7af15e92",
      "version": "1.1.2"
    },
    "long-document-segmented-writing": {
      "allow_implicit_invocation": true,
      "root_hash": "sha256:019542cb93f4fb816270e555f6c6d2728095a0b1445516606c3a549f1cf223a0",
      "version": "3.1.0"
    },
    "runtime-verification": {
      "allow_implicit_invocation": true,
      "root_hash": "sha256:3228068d62f2e9d791a0f204888a1e36bba045395aa2914228f4f7c8ed6cdffb",
      "version": "1.1.1"
    },
    "skill-evaluator": {
      "allow_implicit_invocation": false,
      "root_hash": "sha256:fd57302a7e1f62d18fa3a1ee5e36e93b7fa258d98d83caf653a3ab35c8fda059",
      "version": "5.0.3"
    },
    "software-design": {
      "allow_implicit_invocation": true,
      "root_hash": "sha256:4e6550ab6bacd4f6953c7de4f40edf3f705f66a09ce8a3da6703f1cd4a8f3a30",
      "version": "1.1.1"
    },
    "software-quality-workflows": {
      "allow_implicit_invocation": false,
      "root_hash": "sha256:db46e105e1958e4ca260ee6f6b7e68f8d3af170beb906030b730e0c84081d97f",
      "version": "13.1.0"
    },
    "test-behavior": {
      "allow_implicit_invocation": true,
      "root_hash": "sha256:27e946ac29b402e2df8e977d325a6b3c678f522aa2b27d97cf9c49110ffcd106",
      "version": "1.0.0"
    },
    "writing-plans": {
      "allow_implicit_invocation": true,
      "root_hash": "sha256:de4779fc695c708af68a724050e6b82842753a4ffa889fde9a386aaadc767162",
      "version": "9.1.2"
    }
  }
}
